{"classification":{"authoritative_denominator":false,"design_only":true,"production_vectors_generated":false,"profile_applicability_evaluated":false,"template_fallback_permitted":false},"concept_boundaries":{"cardinality":"Obligations, vector requirements, vector families, and concrete vectors are not required to be one-to-one.","concrete_generated_vector":"One deterministic instantiation; it does not acquire obligation identity and may earn only explicitly declared attribution.","semantic_obligation":"One distinct scientific behavior or question that must be known.","vector_requirement":"A minimum requirement for executable or otherwise admissible evidence capable of satisfying one or more explicitly attributed obligations."},"contract_digest_sha256":"70929bcc605fd9f1b8019aec71a8b1dc0684d96fd64f8cff22260e5861a3ef03","contract_id":"rcid:v1:artifact-set-manifest:h:jcs-sha256-v1:08ad6eb58345a58789afdcb7dbdde82727f9a068f3516aced30075750944d3b8","contract_version":"1.0.0","decision_vocabulary":["required","conditionally-required","not-applicable","not-required-by-feature-semantics","blocked-by-unresolved-semantics"],"denominator_boundary":{"artifact_sha256":{"denominator_forecast":"dab61b42376d757eadada26c31d8fb5c173a508bb6ce780e98a220449ce6e871","obligation_projection":"b25fbeaf80fc8e77f92fb5b36a094896bf30e86d4550ad62982f80a028b605b2","vector_requirements":"a03feacf51bf3af241a7ab4fe0ea74bd29981670de93ec3d880a27516232cca7"},"artifacts_unchanged":true,"obligation_templates":12048,"state":"pre-rederivation-predecessor-bound","vector_requirements":9506},"derivation_id":"rcid:v1:assertion-derivation:u7:01a08125-97ae-7633-b217-ca1d0fa22fbf","derivation_revision_id":"rcid:v1:assertion-derivation-revision:h:jcs-sha256-v1:ef8a57f4bfc27d42391b7a6760a8667341325b26d8fc098f7e22ba763fe83a4a","explainability_contract":{"chain":["semantic assertion(s)","derivation rule revision","facet and archetype","operation/profile condition","prospective obligation identity basis"],"every_feature_facet_has_one_decision":true,"generic_fallback_rule":null,"suppression_is_explained":true},"facet_rules":[{"archetype_ids":["archetype.host-result"],"blocked_semantic_states":["unresolved"],"depends_on_rule_ids":[],"derivation_id":"rcid:v1:assertion-derivation:u7:01a08125-97ae-7633-b217-ca1d0fa22fbf","derivation_revision_id":"rcid:v1:assertion-derivation-revision:h:jcs-sha256-v1:ef8a57f4bfc27d42391b7a6760a8667341325b26d8fc098f7e22ba763fe83a4a","excluded_semantic_states":["no-feature-specific-implication","not-applicable"],"facet_id":"facet.capture","facet_scientific_id":"rcid:v1:semantic-facet:u7:01a07d96-a5bb-7cb5-8307-67a7f6e9bd10","operation_family_ids":["operation-family.single-match","operation-family.iteration-result","operation-family.replacement"],"policy":"semantic-state","profile_capability_predicate":{"clauses":[{"field":"profile.feature_scientific_ids","operator":"contains","value_from":"feature.scientific_id"},{"field":"profile.operation_scientific_ids","operator":"intersects","value_from":"derived.operation_scientific_ids"}],"operator":"all"},"rationale":"Capture obligations are suppressed when research found no feature-specific capture consequence.","reason_template":"{feature_id} {decision} {facet_id} because {semantic_inputs}; apply only through {operation_condition}.","required_semantic_states":["known","implementation-defined","profile-dependent","intentionally-under-specified"],"rule_key":"obligation-facet-rule.capture","rule_revision_id":"rcid:v1:applicability-rule-set:h:jcs-sha256-v1:cc18da2f844c5704a7d06cd84eaca2d0450735978cee33c62733ccbaa1b55816","semantic_input_selectors":["semantic_assertions.capture_result"]},{"archetype_ids":["archetype.complexity-guarantee"],"blocked_semantic_states":["unresolved"],"depends_on_rule_ids":[],"derivation_id":"rcid:v1:assertion-derivation:u7:01a08125-97ae-7633-b217-ca1d0fa22fbf","derivation_revision_id":"rcid:v1:assertion-derivation-revision:h:jcs-sha256-v1:ef8a57f4bfc27d42391b7a6760a8667341325b26d8fc098f7e22ba763fe83a4a","excluded_semantic_states":["no-feature-specific-implication","not-applicable"],"facet_id":"facet.complexity-guarantee","facet_scientific_id":"rcid:v1:semantic-facet:u7:01a07d96-a5bb-7c18-8700-bb361458b6d8","operation_family_ids":["operation-family.single-match","operation-family.iteration-result","operation-family.multi-pattern","operation-family.stream-session"],"policy":"documented-complexity","profile_capability_predicate":{"clauses":[{"field":"profile.feature_scientific_ids","operator":"contains","value_from":"feature.scientific_id"},{"field":"profile.operation_scientific_ids","operator":"intersects","value_from":"derived.operation_scientific_ids"}],"operator":"all"},"rationale":"Only an explicit documented algorithmic guarantee or subset restriction creates this obligation; a timeout measurement cannot.","reason_template":"{feature_id} {decision} {facet_id} because {semantic_inputs}; apply only through {operation_condition}.","required_semantic_states":["known","implementation-defined","profile-dependent","intentionally-under-specified"],"rule_key":"obligation-facet-rule.complexity-guarantee","rule_revision_id":"rcid:v1:applicability-rule-set:h:jcs-sha256-v1:a4bf4cd991f43dc76b2b270b58e73300fdfd8d9ef64982e3699d00845d4ad523","semantic_input_selectors":["semantic_assertions.resource_termination"]},{"archetype_ids":["archetype.defining-positive","archetype.defining-negative"],"blocked_semantic_states":["unresolved"],"depends_on_rule_ids":[],"derivation_id":"rcid:v1:assertion-derivation:u7:01a08125-97ae-7633-b217-ca1d0fa22fbf","derivation_revision_id":"rcid:v1:assertion-derivation-revision:h:jcs-sha256-v1:ef8a57f4bfc27d42391b7a6760a8667341325b26d8fc098f7e22ba763fe83a4a","excluded_semantic_states":["no-feature-specific-implication","not-applicable"],"facet_id":"facet.core-match","facet_scientific_id":"rcid:v1:semantic-facet:u7:01a07d96-a5bb-7cad-a66c-fb28ba334b6b","operation_family_ids":["operation-family.single-match","operation-family.iteration-result","operation-family.replacement","operation-family.multi-pattern","operation-family.stream-session"],"policy":"core-definition","profile_capability_predicate":{"clauses":[{"field":"profile.feature_scientific_ids","operator":"contains","value_from":"feature.scientific_id"},{"field":"profile.operation_scientific_ids","operator":"intersects","value_from":"derived.operation_scientific_ids"}],"operator":"all"},"rationale":"Every canonical feature needs one minimal attributable defining question; a negative question is added only for feature classes with an observable contrast.","reason_template":"{feature_id} {decision} {facet_id} because {semantic_inputs}; apply only through {operation_condition}.","required_semantic_states":["known","implementation-defined","profile-dependent","intentionally-under-specified"],"rule_key":"obligation-facet-rule.core-match","rule_revision_id":"rcid:v1:applicability-rule-set:h:jcs-sha256-v1:7c40de364394e525897665a869735803d9d665b820c5207bae4bc6dce3751cbb","semantic_input_selectors":["semantic_assertions.definition","semantic_variants"]},{"archetype_ids":["archetype.grammar-rejection"],"blocked_semantic_states":["unresolved"],"depends_on_rule_ids":[],"derivation_id":"rcid:v1:assertion-derivation:u7:01a08125-97ae-7633-b217-ca1d0fa22fbf","derivation_revision_id":"rcid:v1:assertion-derivation-revision:h:jcs-sha256-v1:ef8a57f4bfc27d42391b7a6760a8667341325b26d8fc098f7e22ba763fe83a4a","excluded_semantic_states":["no-feature-specific-implication","not-applicable"],"facet_id":"facet.error-diagnostics","facet_scientific_id":"rcid:v1:semantic-facet:u7:01a07d96-a5bb-79d7-a627-016ed27fe059","operation_family_ids":["operation-family.construction","operation-family.single-match","operation-family.iteration-result","operation-family.replacement","operation-family.multi-pattern","operation-family.stream-session","operation-family.serialization"],"policy":"semantic-state","profile_capability_predicate":{"clauses":[{"field":"profile.feature_scientific_ids","operator":"contains","value_from":"feature.scientific_id"},{"field":"profile.operation_scientific_ids","operator":"intersects","value_from":"derived.operation_scientific_ids"}],"operator":"all"},"rationale":"Diagnostic obligations preserve compile, runtime, unsupported, and target-attributable failure classes only where research identifies a meaningful distinction.","reason_template":"{feature_id} {decision} {facet_id} because {semantic_inputs}; apply only through {operation_condition}.","required_semantic_states":["known","implementation-defined","profile-dependent","intentionally-under-specified"],"rule_key":"obligation-facet-rule.error-diagnostics","rule_revision_id":"rcid:v1:applicability-rule-set:h:jcs-sha256-v1:228582c5cc1fd15cc0af9be9529e1ba64030501d34e5a02f72a7c75587624846","semantic_input_selectors":["semantic_assertions.diagnostic_error","semantic_assertions.syntax_grammar"]},{"archetype_ids":["archetype.host-result"],"blocked_semantic_states":["unresolved"],"depends_on_rule_ids":[],"derivation_id":"rcid:v1:assertion-derivation:u7:01a08125-97ae-7633-b217-ca1d0fa22fbf","derivation_revision_id":"rcid:v1:assertion-derivation-revision:h:jcs-sha256-v1:ef8a57f4bfc27d42391b7a6760a8667341325b26d8fc098f7e22ba763fe83a4a","excluded_semantic_states":["no-feature-specific-implication","not-applicable"],"facet_id":"facet.host-api","facet_scientific_id":"rcid:v1:semantic-facet:u7:01a07d96-a5bb-7aaf-aae2-3f9dd227d12c","operation_family_ids":["operation-family.construction","operation-family.single-match","operation-family.iteration-result","operation-family.replacement","operation-family.multi-pattern","operation-family.stream-session","operation-family.serialization"],"policy":"semantic-state","profile_capability_predicate":{"clauses":[{"field":"profile.feature_scientific_ids","operator":"contains","value_from":"feature.scientific_id"},{"field":"profile.operation_scientific_ids","operator":"intersects","value_from":"derived.operation_scientific_ids"}],"operator":"all"